{
  "schema_version": "qratum.capture_state.v1",
  "data_class": "raw",
  "updated_at": "2026-07-12T11:00:00Z",
  "sources": [
    {
      "source": "claude-code",
      "source_version": "2.1.207",
      "status": "connected",
      "configured_hook_events": ["SessionStart", "Stop", "StopFailure", "SessionEnd", "CwdChanged", "SubagentStop"],
      "hook_trust_state": "not_applicable",
      "last_hook_event_at": "2026-07-12T10:59:00Z",
      "pending_event_count": 0,
      "last_refresh_started_at": "2026-07-12T10:59:01Z",
      "last_refresh_finished_at": "2026-07-12T10:59:02Z",
      "last_refresh_result": "success",
      "last_snapshot_at": "2026-07-12T10:59:02Z",
      "root_stream_count": 1,
      "child_stream_count": 1,
      "supported_record_count": 4,
      "unsupported_record_count": 0,
      "usage_coverage": "complete",
      "usage_reconciliation": "not_applicable",
      "schedule_state": "installed_active",
      "warnings": []
    }
  ],
  "streams": [
    {
      "source": "claude-code",
      "root_session_id": "11111111-1111-4111-8111-111111111111",
      "stream_id": "main",
      "state": "preserved",
      "latest_digest": "sha256:aaaaaaaaaaaaaaaaaaaaaaaaaaaaaaaaaaaaaaaaaaaaaaaaaaaaaaaaaaaaaaaa",
      "last_observed_at": "2026-07-12T10:59:00Z",
      "last_preserved_at": "2026-07-12T10:59:02Z",
      "retry_count": 0
    }
  ]
}
